link,titulo,veredito,tags
https://www.aosfatos.org/noticias/nao-e-verdade-que-2020-registra-menos-mortes-diarias-que-2019/,Não é verdade que 2020 registra menos mortes diárias que 2019,falso,['checagem']
https://www.aosfatos.org/noticias/pesquisa-que-aponta-64-de-aprovacao-nao-se-refere-bolsonaro-mas-gestao-lula-em-2008/,"Pesquisa que aponta 64% de aprovação não se refere a Bolsonaro, mas à gestão Lula em 2008",falso,['checagem']
https://www.aosfatos.org/noticias/e-falso-que-tese-de-doutorado-de-milton-ribeiro-nao-consta-em-lugar-nenhum/,É falso que tese de doutorado de Milton Ribeiro não consta ‘em lugar nenhum’,falso,['checagem']
https://www.aosfatos.org/noticias/uso-precoce-de-ivermectina-azitromicina-e-aas-contra-covid-19-nao-tem-respaldo-cientifico/,"Uso precoce de ivermectina, azitromicina e AAS contra Covid-19 não tem respaldo científico",falso,['checagem']
https://www.aosfatos.org/noticias/e-falso-que-oms-nao-recomenda-o-uso-de-mascaras-por-pessoas-saudaveis/,É falso que a OMS não recomenda o uso de máscaras por pessoas saudáveis,falso,['checagem']
https://www.aosfatos.org/noticias/medico-engana-ao-prometer-que-tratamento-caseiro-com-remedios-cura-covid-19/,Médico engana ao prometer que tratamento caseiro com remédios cura a Covid-19,falso,['checagem']
https://www.aosfatos.org/noticias/e-falso-que-novo-ministro-da-educacao-publicou-tweet-com-erros-ortograficos/,É falso que novo ministro da Educação publicou tweet com erros ortográficos,falso,['checagem']
https://www.aosfatos.org/noticias/e-falso-que-camara-liberou-aborto-ate-22-semanas-durante-pandemia/,É falso que Câmara liberou aborto até 22 semanas durante a pandemia,falso,['checagem']
https://www.aosfatos.org/noticias/medicos-desinformam-ao-recomendar-ivermectina-para-prevenir-e-tratar-covid-19/,Médicos desinformam ao recomendar ivermectina para prevenir e tratar Covid-19,falso,['checagem']
https://www.aosfatos.org/noticias/nao-e-de-cortella-texto-que-critica-quem-atira-pedras-em-governantes-por-causa-da-pandemia/,Não é de Cortella texto que critica quem ‘atira pedras’ em governantes por causa da pandemia,falso,['checagem']
https://www.aosfatos.org/noticias/video-de-caminhoes-descartando-agua-e-de-2017-e-sem-relacao-com-transposicao-do-sao-francisco/,Vídeo de caminhões descartando água é de 2017 e sem relação com a transposição do São Francisco,falso,['checagem']
https://www.aosfatos.org/noticias/nao-e-verdade-que-teste-que-diagnostica-covid-19-pode-causar-inflamacao-no-cerebro/,Não é verdade que teste que diagnostica Covid-19 pode causar inflamação no cérebro,falso,['checagem']
https://www.aosfatos.org/noticias/e-falso-que-video-mostra-luiz-mandetta-e-gilmar-mendes-em-restaurante-em-lisboa/,É falso que vídeo mostra Luiz Mandetta e Gilmar Mendes em restaurante em Lisboa,falso,['checagem']
https://www.aosfatos.org/noticias/ivermectina-azitromicina-e-acetilcisteina-nao-tem-eficacia-comprovada-contra-covid-19/,"Ivermectina, azitromicina e acetilcisteína não têm eficácia comprovada contra a Covid-19",falso,['checagem']
https://www.aosfatos.org/noticias/ao-anunciar-que-contraiu-covid-19-bolsonaro-recorre-informacoes-falsas-sobre-pandemia/,"Ao anunciar que contraiu Covid-19, Bolsonaro recorre a informações falsas sobre a pandemia",indisponível,['checagem']
https://www.aosfatos.org/noticias/texto-cita-informacoes-falsas-e-distorcidas-ao-orientar-automedicacao-contra-covid-19/,Texto cita informações falsas e distorcidas ao orientar automedicação contra a Covid-19,falso,['checagem']
https://www.aosfatos.org/noticias/nao-e-verdade-que-medica-foi-demitida-por-perseguicao-politica-na-bahia/,Não é verdade que médica foi demitida por perseguição política na Bahia,falso,['checagem']
https://www.aosfatos.org/noticias/estacao-de-agua-mostrada-em-fotos-foi-concluida-no-governo-dilma-nao-por-bolsonaro/,"Estação de água mostrada em fotos foi concluída no governo Dilma, não por Bolsonaro",falso,['checagem']
https://www.aosfatos.org/noticias/foto-de-militares-em-obra-da-transposicao-nao-foi-tirada-no-governo-de-bolsonaro-mas-no-de-dilma/,"Foto de militares em obra da transposição não foi tirada no governo de Bolsonaro, mas no de Dilma",falso,['checagem']
https://www.aosfatos.org/noticias/posts-atribuem-foto-de-tempestade-no-rs-em-2019-ciclone-recente-em-sc/,Posts atribuem foto de tempestade no RS em 2019 a ciclone recente em SC,falso,['checagem']
https://www.aosfatos.org/noticias/video-de-tempestade-em-2017-compartilhado-como-se-fosse-de-ciclone-no-sul-do-brasil/,Vídeo de tempestade em 2017 é compartilhado como se fosse de ciclone no sul do Brasil,falso,['checagem']
https://www.aosfatos.org/noticias/nao-e-verdade-que-stf-afastou-bolsonaro-de-acoes-para-o-controle-da-pandemia/,Não é verdade que STF afastou Bolsonaro de ações para o controle da pandemia,falso,['checagem']
https://www.aosfatos.org/noticias/fotos-antigas-de-obras-da-transposicao-nao-mostram-trecho-inaugurado-por-bolsonaro/,Fotos antigas de obras da transposição não mostram trecho inaugurado por Bolsonaro,falso,['checagem']
https://www.aosfatos.org/noticias/post-usa-fotos-fora-de-contexto-para-comparar-obras-de-gestoes-de-bolsonaro-e-do-pt/,Post usa fotos fora de contexto para comparar obras de gestões de Bolsonaro e do PT,falso,['checagem']
https://www.aosfatos.org/noticias/e-falso-que-bolsonaro-votou-contra-transposicao-do-rio-sao-francisco-quando-era-deputado/,É falso que Bolsonaro votou contra a transposição do rio São Francisco quando era deputado,falso,['checagem']
https://www.aosfatos.org/noticias/fiscais-do-ibama-nao-incendiaram-mata-no-maranhao-para-culpar-bolsonaro/,Fiscais do Ibama não incendiaram mata no Maranhão para culpar Bolsonaro,falso,['checagem']
https://www.aosfatos.org/noticias/familia-bolsonaro-pediu-o-fim-do-foro-privilegiado-9-vezes-antes-de-decisao-que-beneficiou-flavio/,Família Bolsonaro pediu o fim do foro privilegiado 9 vezes antes de decisão que beneficiou Flávio,indisponível,['checagem']
https://www.aosfatos.org/noticias/foto-de-acude-no-ceara-2017-nao-mostra-obra-inaugurada-por-bolsonaro/,Foto de açude no Ceará é de 2017 e não mostra obra inaugurada por Bolsonaro,falso,['checagem']
https://www.aosfatos.org/noticias/e-falso-que-uso-de-mascaras-reduz-entrada-de-oxigenio-nos-pulmoes/,É falso que uso de máscaras reduz entrada de oxigênio nos pulmões,falso,['checagem']
https://www.aosfatos.org/noticias/tweets-agressivos-contra-personalidades-sao-de-conta-falsa-do-novo-ministro-da-educacao/,Tweets agressivos contra personalidades são de conta falsa do novo ministro da Educação,indisponível,['checagem']
https://www.aosfatos.org/noticias/prefeito-de-sao-paulo-nao-proibiu-uso-de-hidroxicloroquina-nem-disse-que-tomou-medicamento/,Bruno Covas não proibiu nem disse que usou cloroquina,falso,['checagem']
https://www.aosfatos.org/noticias/e-falso-que-hospitais-recebem-r-18-mil-para-cada-registro-de-obito-com-suspeita-de-covid-19/,É falso que hospitais recebem R$ 18 mil para cada registro de óbito com suspeita de Covid-19,falso,['checagem']
https://www.aosfatos.org/noticias/ex-advogado-de-flavio-nao-atua-na-defesa-de-homem-que-esfaqueou-bolsonaro/,Ex-advogado de Flávio não atua na defesa de homem que esfaqueou Bolsonaro,falso,['checagem']
https://www.aosfatos.org/noticias/decisao-da-fda-nao-amplia-uso-de-cloroquina-para-tratamento-da-covid-19-nos-eua/,Decisão da FDA não amplia uso de cloroquina para tratamento da Covid-19 nos EUA,falso,['checagem']
https://www.aosfatos.org/noticias/weintraub-nao-tera-acesso-contas-de-ministros-do-stf-caso-se-torne-diretor-do-banco-mundial/,Weintraub não terá acesso a contas de ministros do STF caso se torne diretor do Banco Mundial,falso,['checagem']
https://www.aosfatos.org/noticias/e-falso-que-hospital-em-fortaleza-fechou-ala-de-covid-19-por-falta-de-pacientes/,É falso que hospital em Fortaleza fechou ala de Covid-19 por falta de pacientes,falso,['checagem']
https://www.aosfatos.org/noticias/e-falso-que-video-mostre-funcionaria-de-loterica-roubando-auxilio-emergencial-de-cliente/,É falso que vídeo mostre funcionária de lotérica roubando auxílio emergencial de cliente,falso,['checagem']
https://www.aosfatos.org/noticias/ex-advogado-de-flavio-bolsonaro-se-contradiz-e-omite-fatos-em-entrevistas-sobre-caso-queiroz/,Ex-advogado de Flávio Bolsonaro se contradiz e omite fatos em entrevistas sobre caso Queiroz,indisponível,['checagem']
https://www.aosfatos.org/noticias/foto-de-ato-pro-bolsonaro-em-2018-circula-como-se-fosse-de-manifestacao-recente/,Foto de ato pró-Bolsonaro em 2018 circula como se fosse de manifestação recente,falso,['checagem']
https://www.aosfatos.org/noticias/foto-de-incendio-em-2005-circula-entre-imagens-de-vandalismo-em-protesto-de-2017/,Foto de incêndio em 2005 circula entre imagens de vandalismo em protesto de 2017,distorcido,['checagem']
https://www.aosfatos.org/noticias/nao-ha-evidencias-de-que-uso-prolongado-de-mascaras-torna-o-sangue-acido/,Não há evidências de que o uso prolongado de máscaras torna o sangue ácido,falso,['checagem']
https://www.aosfatos.org/noticias/moraes-nao-defendeu-atentados-contra-o-stf-antes-de-se-tornar-membro-da-corte/,Moraes não defendeu atentados contra o STF antes de se tornar membro da corte,falso,['checagem']
https://www.aosfatos.org/noticias/foto-de-weintraub-em-aviao-foi-tirada-em-fevereiro-nao-apos-saida-dele-do-mec/,"Foto de Weintraub em avião foi tirada em fevereiro, não após saída dele do MEC",falso,['checagem']
https://www.aosfatos.org/noticias/e-falso-que-oms-disse-que-coronavac-nao-foi-testada-em-nenhum-lugar-do-mundo/,É falso que OMS disse que Coronavac não foi testada em nenhum lugar do mundo,falso,['checagem']
https://www.aosfatos.org/noticias/chas-de-boldo-do-chile-e-de-quina-quina-nao-previnem-nem-curam-covid-19/,Chás de boldo do chile e de quina quina não previnem nem curam Covid-19,falso,['checagem']
https://www.aosfatos.org/noticias/azitromicina-ivermectina-e-nitazoxanida-nao-tem-eficacia-comprovada-contra-covid-19/,"Azitromicina, ivermectina e nitazoxanida não têm eficácia comprovada contra a Covid-19",falso,['checagem']
https://www.aosfatos.org/noticias/enfermeiro-engana-ao-dizer-em-video-que-estados-e-municipios-faturam-com-mortes-por-covid-19/,Enfermeiro engana ao dizer em vídeo que estados e municípios faturam com mortes por Covid-19,falso,['checagem']
https://www.aosfatos.org/noticias/foto-de-joice-hasselmann-em-hospital-e-de-marco-e-nao-tem-relacao-com-covid-19/,Foto de Joice Hasselmann em hospital é de março e não tem relação com a Covid-19,falso,['checagem']
https://www.aosfatos.org/noticias/e-falso-que-policia-apreendeu-dinheiro-na-casa-do-secretario-de-saude-de-belem/,É falso que polícia apreendeu dinheiro na casa do secretário de Saúde de Belém,falso,['checagem']
https://www.aosfatos.org/noticias/video-de-ato-pro-macri-em-2019-circula-como-se-fosse-de-protesto-recente-contra-fernandez-na-argentina/,Vídeo de ato pró-Macri em 2019 circula como se fosse de protesto recente contra Fernández na Argentina,falso,['checagem']
https://www.aosfatos.org/noticias/nao-e-verdade-que-governo-vai-controlar-distribuicao-de-alimentos-na-argentina/,Não é verdade que governo vai controlar distribuição de alimentos na Argentina,falso,['checagem']
https://www.aosfatos.org/noticias/e-falso-que-doria-fechou-contrato-com-chineses-em-2019-para-vacina-contra-o-novo-coronavirus/,É falso que Doria fechou contrato com chineses em 2019 para vacina contra o novo coronavírus,falso,['checagem']
https://www.aosfatos.org/noticias/projeto-aprovado-pela-camara-nao-obriga-usar-mascara-dentro-de-casa/,Projeto aprovado pela Câmara não obriga a usar máscara dentro de casa,falso,['checagem']
https://www.aosfatos.org/noticias/noticia-sobre-suicidio-de-empresario-que-demitiu-223-e-antiga-e-sem-relacao-com-pandemia/,Notícia sobre suicídio de empresário que demitiu 223 é antiga e sem relação com a pandemia,falso,['checagem']
https://www.aosfatos.org/noticias/haddad-nao-celebrou-aniversario-com-amigos-durante-pandemia-foto-e-de-2018/,Haddad não celebrou aniversário com amigos durante a pandemia; foto é de 2018,falso,['checagem']
https://www.aosfatos.org/noticias/e-incorreto-dizer-que-oms-concluiu-que-assintomaticos-nao-tem-potencial-de-transmitir-covid19/,É incorreto dizer que OMS concluiu que assintomáticos não têm potencial de transmitir Covid-19,distorcido,['checagem']
https://www.aosfatos.org/noticias/posts-distorcem-fala-de-porta-voz-da-oms-para-sugerir-que-entidade-recuou-sobre-quarentena/,Posts distorcem fala de porta-voz da OMS para sugerir que entidade recuou sobre quarentena,distorcido,['checagem']
https://www.aosfatos.org/noticias/governo-da-alemanha-nao-enviou-china-conta-bilionaria-de-prejuizos-com-pandemia/,Governo da Alemanha não enviou à China conta bilionária de prejuízos com a pandemia,falso,['checagem']
https://www.aosfatos.org/noticias/pazuello-nao-disse-que-suspeita-de-covid-19-nao-pode-mais-constar-em-atestados-de-obito/,Pazuello não disse que ‘suspeita de Covid-19’ não pode mais constar em atestados de óbito,falso,['checagem']
https://www.aosfatos.org/noticias/e-falso-que-tacos-de-beisebol-com-arame-farpado-foram-apreendidos-em-protesto-em-sp/,É falso que tacos de beisebol com arame farpado foram apreendidos em protesto em SP,falso,['checagem']
https://www.aosfatos.org/noticias/e-falso-que-adelio-incriminou-advogados-e-investigacao-de-facada-em-bolsonaro-foi-reaberta/,É falso que Adélio incriminou advogados e investigação de facada em Bolsonaro foi reaberta,falso,['checagem']
https://www.aosfatos.org/noticias/foto-de-homens-sorrindo-ao-saquear-loja-nao-foi-registrada-durante-protestos-recentes-nos-eua/,Foto de homens sorrindo ao saquear loja não foi registrada durante protestos recentes nos EUA,distorcido,['checagem']
https://www.aosfatos.org/noticias/foto-de-sacos-pretos-nao-mostra-fraude-de-enterros-de-vitimas-de-covid-19-no-brasil/,Foto de sacos pretos não mostra fraude de enterros de vítimas de Covid-19 no Brasil,falso,['checagem']
https://www.aosfatos.org/noticias/nao-e-joao-pedro-jovem-que-aparece-em-fotos-segurando-armas-de-fogo/,Não é João Pedro jovem que aparece em fotos segurando armas de fogo,falso,['checagem']
https://www.aosfatos.org/noticias/imagem-de-conflito-na-grecia-em-2009-circula-como-se-fosse-de-protesto-recente-no-brasil/,Imagem de conflito na Grécia em 2009 circula como se fosse de protesto recente no Brasil,falso,['checagem']
https://www.aosfatos.org/noticias/foto-de-manifestante-em-cima-de-viatura-policial-virada-e-de-2013-nao-atual/,"Foto de manifestante em cima de viatura policial virada é de 2013, não atual",falso,['checagem']
https://www.aosfatos.org/noticias/e-falso-que-lula-visitou-sede-da-gavioes-da-fiel-no-dia-de-protesto-contra-bolsonaro/,É falso que Lula visitou sede da Gaviões da Fiel no dia de protesto contra Bolsonaro,falso,['checagem']
https://www.aosfatos.org/noticias/churchill-nao-disse-que-fascistas-do-futuro-chamarao-si-mesmos-de-antifascistas/,Churchill não disse que 'fascistas do futuro chamarão a si mesmos de antifascistas',falso,['checagem']
https://www.aosfatos.org/noticias/foto-de-protesto-contra-dilma-em-2015-circula-como-se-fosse-de-ato-pro-bolsonaro/,Foto de protesto contra Dilma em 2015 circula como se fosse de ato pró-Bolsonaro,falso,['checagem']
https://www.aosfatos.org/noticias/fotos-antigas-de-manifestantes-queimando-objetos-circulam-nas-redes-como-atuais/,Fotos antigas de manifestantes queimando objetos circulam nas redes como atuais,falso,['checagem']
https://www.aosfatos.org/noticias/manifestantes-ato-contra-bolsonaro-nao-defenderam-nazismo/,Fotos de ato contra Bolsonaro não mostram que manifestantes apoiam nazismo,distorcido,['checagem']
https://www.aosfatos.org/noticias/homem-foi-encontrado-vivo-em-saco-funerario-na-bahia-em-2014-nao-recentemente/,"Homem foi encontrado vivo em saco funerário na Bahia em 2014, não recentemente",falso,['checagem']
https://www.aosfatos.org/noticias/e-falso-que-operacao-da-pf-fez-rio-excluir-1177-mortes-da-estatistica-de-covid-19/,É falso que operação da PF fez Rio excluir 1.177 mortes da estatística de Covid-19,falso,['checagem']
https://www.aosfatos.org/noticias/e-falso-que-policiais-prestaram-continencia-manifestantes-contra-isolamento-em-sp/,É falso que policiais prestaram continência a manifestantes contra isolamento em SP,falso,['checagem']
https://www.aosfatos.org/noticias/governador-do-ceara-nao-proibiu-o-uso-de-bandeiras-do-brasil-no-estado/,Governador do Ceará não proibiu o uso de bandeiras do Brasil no estado,falso,['checagem']
https://www.aosfatos.org/noticias/video-nao-mostra-homem-enterrado-vivo-nem-tem-relacao-com-pandemia/,Vídeo não mostra homem enterrado vivo nem tem relação com a pandemia,falso,['checagem']
https://www.aosfatos.org/noticias/video-em-que-policial-atira-em-surfista-foi-gravado-na-costa-rica-nao-no-brasil/,"Vídeo em que policial atira em surfista foi gravado na Costa Rica, não no Brasil",falso,['checagem']
https://www.aosfatos.org/noticias/foto-de-witzel-almocando-em-angra-e-anterior-pandemia-do-novo-coronavirus/,Foto de Witzel almoçando em Angra é anterior à pandemia,falso,['checagem']
https://www.aosfatos.org/noticias/ao-comparar-mortes-por-covid-19-em-mg-e-sp-posts-ignoram-volume-de-testes-e-subnotificacao/,"Ao comparar mortes por Covid-19 em MG e SP, posts ignoram volume de testes e subnotificação",indisponível,['checagem']
https://www.aosfatos.org/noticias/stf-nao-decidiu-que-dinheiro-publico-roubado-nao-precisa-ser-ressarcido-apos-cinco-anos/,STF não decidiu que dinheiro público roubado não precisa ser ressarcido após cinco anos,falso,['checagem']
https://www.aosfatos.org/noticias/bolsonaro-nao-chamou-apoiadores-de-porcarias-em-reuniao-com-ministros/,Bolsonaro não chamou apoiadores de ‘porcarias’ em reunião com ministros,falso,['checagem']
https://www.aosfatos.org/noticias/post-usa-foto-de-manifestacao-pro-impeachment-de-2016-para-inflar-ato-bolsonarista/,Post usa foto de manifestação pró-impeachment de 2016 para inflar ato bolsonarista,indisponível,['checagem']
https://www.aosfatos.org/noticias/e-falsa-capa-da-veja-que-diz-que-moro-impediu-investigacoes/,É falsa capa da Veja que diz que Moro impediu investigações,falso,['checagem']
https://www.aosfatos.org/noticias/em-reuniao-ministerial-bolsonaro-falseia-dado-de-desemprego-e-se-contradiz-sobre-interferencia-no-governo/,"Em reunião ministerial, Bolsonaro falseia dado de desemprego e se contradiz sobre interferência no governo",indisponível,['checagem']
https://www.aosfatos.org/noticias/e-falso-que-filho-de-william-bonner-recebe-auxilio-emergencial-de-r-600/,É falso que filho de William Bonner recebe auxílio emergencial de R$ 600,falso,['checagem']
https://www.aosfatos.org/noticias/e-falso-que-filho-de-fatima-bernardes-e-william-bonner-tenha-atropelado-e-matado-uma-pessoa/,É falso que filho de Fátima Bernardes e William Bonner tenha atropelado e matado uma pessoa,falso,['checagem']
https://www.aosfatos.org/noticias/e-falso-que-pesquisa-indica-tratamento-com-hidroxicloroquina-como-o-mais-eficaz-contra-covid-19/,É falso que pesquisa indica tratamento com hidroxicloroquina como o mais eficaz contra Covid-19,indisponível,['checagem']
https://www.aosfatos.org/noticias/nao-existe-taxa-de-sobrevivencia-covid-19-citada-em-posts-nas-redes-sociais/,Não existe a taxa de sobrevivência à Covid-19 citada em posts nas redes sociais,falso,['checagem']
https://www.aosfatos.org/noticias/substancias-presentes-no-boldo-e-na-quina-nao-tratam-covid-19/,Substâncias presentes no boldo e na quina não tratam Covid-19,falso,['checagem']
https://www.aosfatos.org/noticias/profissionais-de-saude-nao-viraram-costas-para-bruno-covas-video-foi-gravado-na-belgica/,Profissionais de saúde não viraram as costas para Bruno Covas; vídeo foi gravado na Bélgica,falso,['checagem']
https://www.aosfatos.org/noticias/e-falso-que-o-hospital-central-da-pm-no-rio-tem-apenas-um-paciente-com-covid-19/,É falso que o Hospital Central da PM no Rio tem apenas um paciente com Covid-19,falso,['checagem']
https://www.aosfatos.org/noticias/new-york-times-nao-publicou-artigo-dizendo-que-tv-globo-acaba-com-o-brasil/,‘The New York Times’ não publicou artigo dizendo que TV Globo ‘acaba com o Brasil’,falso,['checagem']
https://www.aosfatos.org/noticias/e-falso-que-estados-recebem-verba-federal-cada-obito-registrado-por-covid-19/,É falso que estados recebem verba federal a cada óbito registrado por Covid-19,falso,['checagem']
https://www.aosfatos.org/noticias/foto-em-que-mandetta-e-helder-barbalho-se-cumprimentam-sem-mascaras-e-de-2019/,Foto em que Mandetta e Helder Barbalho se cumprimentam sem máscaras é de 2019,falso,['checagem']
https://www.aosfatos.org/noticias/e-falso-post-em-que-o-juiz-marcelo-bretas-defende-uso-de-hidroxicloroquina/,É falso post em que o juiz Marcelo Bretas defende uso de hidroxicloroquina,falso,['checagem']
https://www.aosfatos.org/noticias/e-falso-que-partidos-pediram-e-stf-barrou-hospitais-militares-para-pacientes-com-covid-19/,É falso que partidos pediram e STF barrou hospitais militares para pacientes com Covid-19,falso,['checagem']
https://www.aosfatos.org/noticias/video-de-briga-entre-ambulantes-e-fiscais-em-sp-e-antigo-e-nao-tem-relacao-com-isolamento/,Vídeo de briga entre ambulantes e fiscais em SP é antigo e não tem relação com isolamento,falso,['checagem']
https://www.aosfatos.org/noticias/covid-19-nao-e-causada-por-bacteria-nem-pode-ser-curada-com-aspirina/,Covid-19 não é causada por bactéria nem pode ser curada com aspirina,falso,['checagem']
https://www.aosfatos.org/noticias/comparacao-entre-minas-e-ceara-engana-ao-omitir-nivel-de-testagem-de-covid-19-nos-estados/,Comparação entre Minas e Ceará engana ao omitir nível de testagem de Covid-19 nos estados,distorcido,['checagem']
https://www.aosfatos.org/noticias/numero-de-mortos-por-milhao-de-habitantes-nao-evidencia-que-pandemia-no-brasil-e-menos-grave/,Número de mortos por milhão de habitantes não evidencia que pandemia no Brasil é menos grave,falso,['checagem']
https://www.aosfatos.org/noticias/nao-e-possivel-afirmar-que-pacientes-foram-curados-por-cloroquina-ou-corticoides-no-piaui/,Não é possível afirmar que pacientes foram curados por cloroquina ou corticoides no Piauí,indisponível,['checagem']
https://www.aosfatos.org/noticias/e-falso-que-mandetta-editou-protocolo-da-morte-que-indica-tamiflu-para-covid-19/,É falso que Mandetta editou ‘protocolo da morte’ que indica Tamiflu para Covid-19,falso,['checagem']
https://www.aosfatos.org/noticias/cha-de-boldo-nao-combate-sintomas-nem-cura-covid-19/,Chá de boldo não combate sintomas nem cura a Covid-19,falso,['checagem']
https://www.aosfatos.org/noticias/e-falso-que-lula-dilma-e-dirceu-anunciaram-live-sobre-combate-corrupcao/,"É falso que Lula, Dilma e Dirceu anunciaram live sobre combate à corrupção",falso,['checagem']
https://www.aosfatos.org/noticias/numero-de-registros-de-obitos-no-brasil-em-abril-nao-foi-menor-que-em-2019-e-2018/,Número de registros de óbitos no Brasil em abril não foi menor que em 2019 e 2018,distorcido,['checagem']
https://www.aosfatos.org/noticias/ceara-nao-teve-mais-mortes-por-doencas-respiratorias-em-2019-do-que-em-2020/,Ceará não teve mais mortes por doenças respiratórias em 2019 do que em 2020,falso,['checagem']
https://www.aosfatos.org/noticias/e-falso-que-apoiadores-de-bolsonaro-tenham-feito-saudacao-nazista-gesto-e-religioso/,É falso que apoiadores de Bolsonaro tenham feito saudação nazista; gesto é religioso,falso,['checagem']
https://www.aosfatos.org/noticias/e-falso-que-hospital-de-campanha-da-unicamp-foi-desmontado-por-falta-de-pacientes/,É falso que hospital de campanha da Unicamp foi desmontado por falta de pacientes,falso,['checagem']
https://www.aosfatos.org/noticias/governador-de-ny-nao-mostrou-que-isolamento-e-ineficaz-contra-covid-19/,Governador de NY não mostrou que isolamento é ineficaz contra Covid-19,falso,['checagem']
https://www.aosfatos.org/noticias/nao-e-verdade-que-uso-prolongado-de-mascara-de-protecao-causa-hipoxia/,Não é verdade que uso prolongado de máscara de proteção causa hipóxia,falso,['checagem']
https://www.aosfatos.org/noticias/e-falso-que-lula-minimizou-assassinatos-cometidos-por-menores-em-declaracao-de-2015/,É falso que Lula minimizou assassinatos cometidos por menores em declaração de 2015,falso,['checagem']
https://www.aosfatos.org/noticias/e-falso-que-globo-exibiu-foto-de-caixoes-tirada-em-2013-como-se-fossem-de-vitimas-da-covid-19/,É falso que Globo exibiu foto de caixões tirada em 2013 como se fossem de vítimas da Covid-19,falso,['checagem']
https://www.aosfatos.org/noticias/toffoli-nao-disse-que-grupos-de-whatsapp-devem-ser-registrados-em-cartorio/,Toffoli não disse que grupos de WhatsApp devem ser registrados em cartório,falso,['checagem']
https://www.aosfatos.org/noticias/e-falso-que-170-milhoes-de-pessoas-se-inscreveram-para-o-auxilio-emergencial/,É falso que 170 milhões de pessoas se inscreveram para o auxílio emergencial,falso,['checagem']
https://www.aosfatos.org/noticias/e-falso-que-numero-de-mortes-por-covid-19-caiu-em-manaus-apos-visita-do-ministro-da-saude/,É falso que número de mortes por Covid-19 caiu em Manaus após visita do ministro da Saúde,falso,['checagem']
https://www.aosfatos.org/noticias/nao-e-verdade-que-covid-19-pode-ser-tratada-com-antibioticos/,Não é verdade que Covid-19 pode ser tratada com antibióticos,falso,['checagem']
https://www.aosfatos.org/noticias/ex-ministro-do-stf-ayres-britto-nao-e-autor-de-carta-com-criticas-moro/,Ex-ministro do STF Ayres Britto não é autor de carta com críticas a Moro,falso,['checagem']
