link,titulo,veredito,tags
https://www.aosfatos.org/noticias/falso-governos-eua-canada-alerta-frio-extremo-brasil/,É falso que governos de EUA e Canadá emitiram alerta sobre frio extremo no Brasil,falso,['checagem']
https://www.aosfatos.org/noticias/video-senador-uniao-brasil-brigando-aeroporto/,"Vídeo mostra senador do União Brasil, não do PT, brigando com atendente em aeroporto",falso,['checagem']
https://www.aosfatos.org/noticias/comparacao-falsa-lula-piso-magisterio-publico/,Comparação engana ao fazer crer que Lula não reajustou piso do magistério público,falso,['checagem']
https://www.aosfatos.org/noticias/video-ato-antifascista-alemanha-agricultores/,"Vídeo mostra ato antifascista na Alemanha, não manifestação de agricultores contra governo alemão",falso,['checagem']
https://www.aosfatos.org/noticias/video-desmaio-cha-revelacao-nao-morte-vacina-covid/,"Vídeo mostra desmaio em chá revelação antes da pandemia, não morte causada por vacina contra Covid",falso,['checagem']
https://www.aosfatos.org/noticias/falso-anielle-franco-racismo-genital-padre-julio/,Anielle Franco não disse que padre Júlio Lancellotti sofre ‘racismo genital’,falso,['checagem']
https://www.aosfatos.org/noticias/montagem-globalistas-forum-economico-mundial/,Montagem satírica com ofensas a ‘globalistas’ no Fórum Econômico Mundial circula como se fosse real,falso,['checagem']
https://www.aosfatos.org/noticias/lula-contexto-brasileiros-pobres/,Fala de Lula é tirada de contexto para alegar que há brasileiros que desejam ser pobres,não é bem assim,['checagem']
https://www.aosfatos.org/noticias/falso-poupanca-ensino-medio-rede-publica/,Lula não criou poupança para todos os estudantes de ensino médio da rede pública,falso,['checagem']
https://www.aosfatos.org/noticias/video-falso-eduardo-paes-danca/,"Vídeo em que Eduardo Paes dança em festa é de setembro de 2023, não atual",falso,['checagem']
https://www.aosfatos.org/noticias/falso-video-cargueiro-americano-missil-iemen/,É falso que vídeo mostra cargueiro americano atingido por míssil na costa do Iêmen,falso,['checagem']
https://www.aosfatos.org/noticias/golpe-versao-falsa-subway-surfers/,"Golpe usa vídeos falsos de personalidades, de Lula a Felipe Neto, para vender versão inexistente do jogo Subway Surfers",falso,['checagem']
https://www.aosfatos.org/noticias/falso-presos-auxilio-maior-que-salario-minimo/,Posts enganam ao afirmar que presos recebem auxílio maior que salário mínimo,falso,['checagem']
https://www.aosfatos.org/noticias/anielle-franco-nao-atribuiu-chuvas-a-racismo-ambiental/,Ministra Anielle Franco não atribuiu chuvas a racismo ambiental,falso,['checagem']
https://www.aosfatos.org/noticias/falso-boneca-bebe-palestino-morto/,É falso que boneca simulando bebê palestino morto tenha sido produzida em Israel e esteja à venda,falso,['checagem']
https://www.aosfatos.org/noticias/video-paulo-henrique-amorim-quadrilha-temer-nao-lula/,"Paulo Henrique Amorim se referia a Temer, e não a Lula, em vídeo em que afirma que ‘quadrilha assaltou o poder’",falso,['checagem']
https://www.aosfatos.org/noticias/video-homem-galao-chafariz-agua-nordeste/,Vídeo de homem enchendo galão em chafariz não prova que Nordeste está sem água,falso,['checagem']
https://www.aosfatos.org/noticias/falso-dispositivo-nanotex-conta-de-energia/,É falso que dispositivo Nanotex reduz valor da conta de energia elétrica,falso,['checagem']
https://www.aosfatos.org/noticias/video-balsa-madeira-2018-nao-atual/,"Vídeo que mostra balsa carregada com toras de madeira é de 2018, não atual",falso,['checagem']
https://www.aosfatos.org/noticias/video-mariana-godoy-alckmin/,É de 2017 vídeo em que Mariana Godoy responde a Alckmin que problema do Brasil é má administração,não é bem assim,"['boataria política', 'checagem']"
https://www.aosfatos.org/noticias/golpe-sorteio-toyota-hilux/,Promessa de sorteio de Toyota Hilux que ‘não foi vendida no fim do ano’ é golpe,falso,['checagem']
https://www.aosfatos.org/noticias/falso-traficantes-roubaram-caminhao-bombeiros-resgate/,É falso que traficantes roubaram caminhão do Corpo de Bombeiros e pediram R$ 500 mil de resgate,falso,['checagem']
https://www.aosfatos.org/noticias/mudanca-licenciamento-veiculos-rj-sem-relacao-bolsonaro-lula/,Mudança no licenciamento dos veículos no RJ não tem relação com Bolsonaro ou Lula,falso,['checagem']
https://www.aosfatos.org/noticias/mortes-yanomamis-2023/,Posts usam dado desatualizado para alegar que mortes de yanomamis cresceram 50% em 2023,falso,['checagem']
https://www.aosfatos.org/noticias/falso-pix-taxado-banco-central-janeiro-2024/,Banco Central não passou a taxar Pix em janeiro de 2024,falso,['checagem']
https://www.aosfatos.org/noticias/falso-adesao-saque-aniversario-fgts-terminara-marco-2024/,É falso que adesão ao saque-aniversário do FGTS terminará em março de 2024,falso,['checagem']
https://www.aosfatos.org/noticias/posts-banner-avante-zema-lula/,Posts usam banner do Avante para dar a entender que Zema apoiou Lula em 2022,não é bem assim,['checagem']
https://www.aosfatos.org/noticias/parlamentares-negam-provas-8-de-janeiro/,"‘Sem armas’ e ‘com senhorinhas orando’: em vídeo, parlamentares negam provas do 8 de Janeiro",indisponível,['checagem']
https://www.aosfatos.org/noticias/video-pm-minas-governo-federal/,Vídeo que mostra ação truculenta da PM de Minas não tem relação com governo federal,falso,['checagem']
https://www.aosfatos.org/noticias/governo-lula-nao-pagou-1-milhao-choquei-2023/,Governo Lula não pagou R$ 1 milhão à Choquei em 2023,falso,['checagem']
https://www.aosfatos.org/noticias/falso-leilane-neubarth-bolsonaristas-cachorros/,É falso que Leilane Neubarth chamou apoiadores de Bolsonaro de cachorros,falso,['checagem']
https://www.aosfatos.org/noticias/falso-nova-lei-cpf-bolsa-familia/,Nova lei não exige atualização de CPF para quem recebe Bolsa Família e BPC,falso,['checagem']
https://www.aosfatos.org/noticias/sosia-janja-video-bolsonaro/,"Sósia de Janja aparece em vídeo com Bolsonaro, não a primeira-dama",falso,['checagem']
https://www.aosfatos.org/noticias/lista-ilha-jeffrey-epstein-celebridades-falsa/,Lista de ‘frequentadores da ilha’ de Jeffrey Epstein que associa celebridades a tráfico sexual é falsa,falso,"['boataria política', 'checagem']"
https://www.aosfatos.org/noticias/video-manifestantes-argentina-2017-nao-atual/,"É de 2017, não atual, vídeo em que manifestantes atiram pedras contra polícia na Argentina",não é bem assim,['checagem']
https://www.aosfatos.org/noticias/falso-bolsonaro-reajuste-salario-minimo-6-reais/,É falso que Bolsonaro reajustou em apenas R$ 6 salário mínimo de 2020,falso,['checagem']
https://www.aosfatos.org/noticias/falso-lula-recusou-vacina-japonesa-contra-dengue/,É falso que Lula recusou vacina japonesa contra a dengue para esperar imunizante nacional,falso,['checagem']
https://www.aosfatos.org/noticias/falso-lula-exercito-buracos-bolsonaro/,É falso que Lula obrigou militares a cavarem buracos onde Bolsonaro teve mais votos,falso,['checagem']
https://www.aosfatos.org/noticias/falso-video-tsunami-rio-de-janeiro/,Vídeos não mostram tsunami no Rio de Janeiro em 31 de dezembro,falso,['checagem']
https://www.aosfatos.org/noticias/bula-pfizer-bivalente-pediatrica/,Posts enganam ao difundir bula de vacina bivalente da Pfizer como se fosse pediátrica,falso,['checagem']
https://www.aosfatos.org/noticias/desinformacao-em-2023/,Desinformação sobre segurança e economia ganhou força em 2023,indisponível,['checagem']
https://www.aosfatos.org/noticias/video-cnn-piora-economia/,"É de março, não atual, notícia da CNN Brasil sobre piora nas projeções econômicas",falso,['checagem']
https://www.aosfatos.org/noticias/falso-ocde-stf-cumplice-corrupcao/,OCDE não disse que STF é cúmplice de corrupção,falso,['checagem']
https://www.aosfatos.org/noticias/falso-dilma-ministerio-da-defesa/,É falso que Dilma Rousseff assumirá Ministério da Defesa de Lula,falso,['checagem']
https://www.aosfatos.org/noticias/golpe-iphone-98-reais-magazine-luiza/,Post que anuncia leilão de iPhone a partir de R$ 98 no Magazine Luiza é golpe,falso,['checagem']
https://www.aosfatos.org/noticias/falso-dpvat-voltara-janeiro-2024/,É falso que DPVAT voltará a ser cobrado em janeiro de 2024 no valor de R$ 292,falso,['checagem']
https://www.aosfatos.org/noticias/lula-alegacoes-enganosas-2023/,"Em primeiro ano de mandato, Lula repete alegações enganosas sobre fome, economia e governo Bolsonaro",indisponível,"['discurso oficial', 'checagem']"
https://www.aosfatos.org/noticias/falso-app-celular-seguro-permite-governo-acessar-conteudo/,É falso que app Celular Seguro permite ao governo acessar conteúdo de aparelho,falso,['checagem']
https://www.aosfatos.org/noticias/falso-ginasta-morreu-vacina-covid/,É falso que ginasta morreu após tomar vacina contra Covid-19,falso,['checagem']
https://www.aosfatos.org/noticias/video-ronnie-von-critica-violencia-2015/,"É de 2015, não atual, vídeo em que Ronnie Von critica violência no país",não é bem assim,['checagem']
https://www.aosfatos.org/noticias/falso-lula-medida-antecipar-aposentadoria/,É falso que Lula publicou medida para antecipar a aposentadoria dos brasileiros,falso,['checagem']
https://www.aosfatos.org/noticias/falso-governo-lula-gastou-16-bilhoes-lei-rouanet--2023/,É falso que governo Lula gastou R$ 16 bilhões com Lei Rouanet em 2023,falso,['checagem']
https://www.aosfatos.org/noticias/marcola-lula-assessor-nao-pcc/,"Marcola citado por Lula em live é seu assessor, não líder do PCC",falso,['checagem']
https://www.aosfatos.org/noticias/foto-manifestacao-2019-argentina-protesto-milei/,Foto de manifestação ocorrida em 2019 na Argentina circula como se mostrasse protesto recente contra Milei,falso,['checagem']
https://www.aosfatos.org/noticias/lula-nao-fez-profecia-fim-do-mundo-onu/,Lula não fez profecia sobre fim do mundo em discurso na Assembleia Geral da ONU,falso,['checagem']
https://www.aosfatos.org/noticias/video-desabamento-bahia-circula-desmoronamento-maceio/,Vídeo de desabamento de barragem na Bahia circula como se mostrasse desmoronamento em Maceió,falso,['checagem']
https://www.aosfatos.org/noticias/video-2018-mortes-vacina-febre-amarela-nao-covid/,"Vídeo de 2018 noticiava mortes causadas por vacina contra febre amarela, e não por imunizante contra Covid-19",falso,['checagem']
https://www.aosfatos.org/noticias/mudancas-aposentadoria-aprovadas-bolsonaro-nao-lula/,"Mudanças na aposentadoria que passam a valer em 2024 foram aprovadas no governo Bolsonaro, não no governo Lula",não é bem assim,['checagem']
https://www.aosfatos.org/noticias/video-antigo-general-indenizacao-anistiados/,"Vídeo antigo mostra vereador, e não general, mentindo sobre pena de morte e indenização para anistiados políticos",falso,['checagem']
https://www.aosfatos.org/noticias/uniforme-petrobras-marketing-nao-sera-usado/,Uniforme estilizado da Petrobras foi criado para ação de marketing e não será usado por funcionários,falso,['checagem']
https://www.aosfatos.org/noticias/video-protesto-garimpeiros-nao-ato-contra-lula-corte-agua-nordeste/,"Vídeo mostra protesto de garimpeiros, não ato contra governo Lula por corte no fornecimento de água ao Nordeste",falso,['checagem']
https://www.aosfatos.org/noticias/lei-padre-lancelotti-nao-proibe-cercas-e-grades/,Lei Padre Júlio Lancelotti não proíbe instalação de cercas e grades em propriedades privadas,falso,['checagem']
https://www.aosfatos.org/noticias/golpistas-programa-ceia-natal/,Golpistas inventam programa de distribuição de ceia de Natal para enganar cidadãos,falso,['checagem']
https://www.aosfatos.org/noticias/saque-social-golpe/,Posts enganosos inventam programa de ‘saque social’ para aplicar golpe,falso,['checagem']
https://www.aosfatos.org/noticias/site-auxilio-cesta-basica-golpe-roubo-dados-pessoais/,Site que promete auxílio para compra de cesta básica esconde golpe de roubo de dados pessoais,falso,['checagem']
https://www.aosfatos.org/noticias/golpe-programa-inexistente-resgate-prosperidade/,Golpe simula programa inexistente do governo federal para “resgate da prosperidade”,falso,['checagem']
https://www.aosfatos.org/noticias/video-lula-aumento-precos-alimentos-2020-nao-atual/,Vídeo de 2020 em que Lula diz que preços dos alimentos vão subir circula como atual,falso,['checagem']
https://www.aosfatos.org/noticias/falso-video-dono-seara-xingando-apoiadores-bolsonaro/,É falso que vídeo mostra dono da Seara xingando apoiadores de Bolsonaro,falso,['checagem']
https://www.aosfatos.org/noticias/video-festa-vidigal-2021-nao-apos-dino-stf/,"Vídeo que mostra festa no Vidigal é de 2021, não após indicação de Dino ao STF",falso,['checagem']
https://www.aosfatos.org/noticias/falso-lula-cortou-8-milhoes-bolsa-familia-gastou-1-bilhao-viagens/,É falso que Lula cortou 8 milhões de cadastros do Bolsa Família e gastou mais de R$ 1 bilhão em viagens,falso,['checagem']
https://www.aosfatos.org/noticias/nao-ha-provas-bolsonaro-vaiado-restaurante-argentina/,Não há provas de que Bolsonaro foi vaiado em restaurante na Argentina,falso,['checagem']
https://www.aosfatos.org/noticias/gravacao-bolsonaro-ovacionado-2022-nao-argentina/,"Gravação que mostra Bolsonaro sendo ovacionado foi registrada em 2022 em Brasília, e não recentemente na Argentina",falso,['checagem']
https://www.aosfatos.org/noticias/falso-lula-cancelou-perdao-dividas-fies/,É falso que Lula cancelou perdão a dívidas do Fies,falso,['checagem']
https://www.aosfatos.org/noticias/video-2020-bolsonaro-posse-milei-argentina/,Vídeo de 2020 em que imigrante confronta Bolsonaro circula como se fosse registro de posse de Milei na Argentina,falso,['checagem']
https://www.aosfatos.org/noticias/videos-garimpo-ilegal-invasao-exercito-venezuelano/,"Vídeos mostram ação contra o garimpo ilegal, não invasão do exército venezuelano",falso,['checagem']
https://www.aosfatos.org/noticias/post-distribuicao-aparelhos-ar-condicionado-golpe/,Post que anuncia programa de distribuição de aparelhos de ar-condicionado é golpe,falso,['checagem']
https://www.aosfatos.org/noticias/falso-golpe-havan-smartphones-179-reais/,Golpistas usam vídeo manipulado para fazer crer que Havan está vendendo smartphones a R$179,falso,['checagem']
https://www.aosfatos.org/noticias/falso-manifestante-batom-simular-agressao-alesp/,É falso que manifestante usou batom para simular agressão policial durante protesto na Alesp,falso,['checagem']
https://www.aosfatos.org/noticias/video-nicolas-maduro-hostilizado-desfile-2017/,"Vídeo que mostra Nicolás Maduro sendo hostilizado em desfile é de 2017, não recente",falso,['checagem']
https://www.aosfatos.org/noticias/embraer-nao-produziu-video-com-criticas-ao-governo/,Embraer não produziu vídeo com críticas ao governo,falso,['checagem']
https://www.aosfatos.org/noticias/reportagem-tropas-brasileiras-fronteira-venezuela-2019/,"Reportagem que mostra tropas brasileiras na fronteira com a Venezuela é de 2019, não atual",não é bem assim,['checagem']
https://www.aosfatos.org/noticias/falso-flavio-dino-carta-abandonar-comunismo/,É falso que Flávio Dino afirmou em carta ao Senado que irá abandonar comunismo,falso,['checagem']
https://www.aosfatos.org/noticias/video-8-de-janeiro-imagens-apagadas-ministerio-justica/,Vídeo com discussão entre militares sobre 8 de janeiro não integra imagens apagadas das câmeras do Ministério da Justiça,falso,['checagem']
https://www.aosfatos.org/noticias/deslizamento-br-101-colapso-braskem-maceio/,Deslizamento na BR-101 não tem relação com colapso de mina da Braskem em Maceió,falso,['checagem']
https://www.aosfatos.org/noticias/declaracao-falsa-milei-calote-emprestimo-brasil-nunca-fez-argentina/,Declaração falsa de Milei ameaça calote a empréstimo que Brasil nunca fez à Argentina,falso,['checagem']
https://www.aosfatos.org/noticias/cop-28-lula-dados-meio-ambiente/,"Na COP-28, Lula cita dados errados sobre Ministério do Meio Ambiente e produção de alimentos",indisponível,"['discurso oficial', 'checagem']"
https://www.aosfatos.org/noticias/falso-bolsonaro-maceio-mina-braskem/,Foto de Bolsonaro em Maceió é de 2021 e não tem relação com colapso de mina da Braskem,falso,['checagem']
https://www.aosfatos.org/noticias/recorde-ocupados-ibge-bolsonaro-lula/,"Viral usa dados incomparáveis para dizer que recorde de ocupados ocorreu sob Bolsonaro, não Lula",não é bem assim,['checagem']
https://www.aosfatos.org/noticias/falso-principe-arabia-saudita-cancelou-reuniao-lula-novembro-2023/,Príncipe herdeiro da Arábia Saudita não cancelou reunião com Lula em novembro de 2023,falso,['checagem']
https://www.aosfatos.org/noticias/falso-juiz-anulou-inelegibilidade-jair-bolsonaro/,É falso que juiz anulou inelegibilidade de Jair Bolsonaro,falso,['checagem']
https://www.aosfatos.org/noticias/video-homem-trajes-indigenas-nao-flavio-dino/,Homem com trajes indígenas que aparece dançando em vídeo não é Flávio Dino,falso,['checagem']
https://www.aosfatos.org/noticias/audio-satirico-flavio-dino-plano-destruir-a-economia/,Áudio satírico circula fora de contexto para fazer crer que Dino confessou plano para destruir a economia,falso,['checagem']
https://www.aosfatos.org/noticias/video-nao-mostra-exercito-fronteira-brasil-venezuela/,Vídeo não mostra comboio do Exército brasileiro na fronteira com a Venezuela,falso,['checagem']
https://www.aosfatos.org/noticias/falso-haddad-confisco-poupancas/,É falso que Haddad anunciou confisco de R$ 23 bilhões de poupanças de brasileiros,falso,['checagem']
https://www.aosfatos.org/noticias/propostas-congresso-restringir-aborto-legal-desinformacao-justificativa/,Propostas no Congresso que restringem aborto legal usam desinformação como justificativa,indisponível,"['discurso oficial', 'checagem']"
https://www.aosfatos.org/noticias/falso-video-briga-estudantes-professor-nova-esperanca/,É falso que vídeo mostra briga entre estudantes e professor em Nova Esperança,falso,['checagem']
https://www.aosfatos.org/noticias/falso-video-venezuelanos-brasil-invadir-guiana/,"Vídeo mostra confronto na Colômbia, não venezuelanos atravessando Brasil para invadir Guiana",falso,['checagem']
https://www.aosfatos.org/noticias/video-medicos-sem-revalida-2020/,Vídeo que critica projeto para contratar médicos sem Revalida é de 2020,não é bem assim,['checagem']
https://www.aosfatos.org/noticias/governo-lula-nao-propos-taxar-influenciadores-digitais/,Governo Lula não propôs taxar influenciadores digitais em 4%,não é bem assim,['checagem']
https://www.aosfatos.org/noticias/falso-premio-nobel-paz-lula/,Nobel da Paz só revela candidatos após 50 anos e não há provas de que Lula tenha concorrido ao prêmio,falso,['checagem']
https://www.aosfatos.org/noticias/falso-viral-comparacao-gastos-bolsonaro-lula-cartao-corporativo/,Viral faz comparação incorreta entre gastos de Bolsonaro e Lula com cartão corporativo,falso,['checagem']
https://www.aosfatos.org/noticias/falso-demissoes-contingenciamento-ministerio-saude/,Demissões em instituto no RS não têm relação com contingenciamento de verba do Ministério da Saúde,falso,['checagem']
https://www.aosfatos.org/noticias/falso-reforma-tributaria-nao-e-ceo-jbs/,Homem que mente sobre reforma tributária em vídeo não é CEO da JBS,falso,['checagem']
https://www.aosfatos.org/noticias/falso-decimo-terceiro-bolsa-familia-2023/,É falso que governo Lula pagará 13ª parcela do Bolsa Família em 2023,falso,['checagem']
https://www.aosfatos.org/noticias/miss-colombia-denunciou-suposta-fraude-nao-mulher-trans-concurso/,"Miss Colômbia denunciou suposta fraude em concurso, não presença de mulher trans",falso,['checagem']
https://www.aosfatos.org/noticias/falso-danca-picanha-fatiada-lei-rouanet/,"É falso que ‘dança da picanha fatiada’ ganhou R$ 6,7 milhões de incentivo via Lei Rouanet",falso,['checagem']
https://www.aosfatos.org/noticias/falso-video-antigo-ato-na-paulista-8-de-janeiro/,Vídeo de 2015 circula como se mostrasse ato recente na Paulista contra morte de réu do 8 de Janeiro,falso,['checagem']
https://www.aosfatos.org/noticias/medicos-que-operaram-lula-nao-foram-executados/,Médicos que operaram Lula não foram executados,falso,['checagem']
https://www.aosfatos.org/noticias/falso-dpvat-cobrado-292-reais/,É falso que DPVAT voltou a ser cobrado em novembro no valor de R$ 292,falso,['checagem']
https://www.aosfatos.org/noticias/falso-video-israelenses-descartando-leite/,É falso que vídeo mostra israelenses descartando caixas de leite doadas à Faixa de Gaza,falso,['checagem']
https://www.aosfatos.org/noticias/cena-serie-nao-forca-nacional-recebendo-propina-traficantes-rj/,Cena de série circula como se mostrasse membros da Força Nacional recebendo propina de traficantes no RJ,falso,['checagem']
https://www.aosfatos.org/noticias/falso-gravacao-bolsonaro-aeroporto-argentina/,"Gravação não mostra Bolsonaro chegando a aeroporto na Argentina, e sim recepção em Natal em 2017",falso,['checagem']
https://www.aosfatos.org/noticias/video-gravacao-serie-nao-recepcao-chefe-do-trafico-rj/,"Vídeo mostra gravação de série, não chefe do tráfico sendo recepcionado ao deixar prisão no RJ",falso,['checagem']
https://www.aosfatos.org/noticias/lula-nao-disse-imposto-de-renda-acabara-ano-de-2640/,Lula não disse que Imposto de Renda acabará no ano de 2640,falso,['checagem']
https://www.aosfatos.org/noticias/falso-milei-twitter-tu-lugar-esta-en-la-prision/,É falso que Milei disse a Lula no X: ‘Tu lugar está en la prisión’,falso,['checagem']
https://www.aosfatos.org/noticias/falso-indenizacao-ministerio-da-justica-invasor-casa/,Ministério da Justiça não vai indenizar invasor que se machucou ao tentar pular portão de casa,falso,['checagem']
https://www.aosfatos.org/noticias/lula-eleicoes-nordestinos-analfabetos/,Lula não disse que ganhou as eleições porque os nordestinos são analfabetos,falso,['checagem']
https://www.aosfatos.org/noticias/falso-guga-chacra-chorou-vitoria-milei/,É falso que Guga Chacra chorou ao vivo após vitória de Milei na Argentina,falso,['checagem']
https://www.aosfatos.org/noticias/nao-e-verdade-arroz-paquistanes-infectado-vendido-no-brasil/,Não é verdade que arroz paquistanês infectado por vírus está sendo vendido no Brasil,falso,['checagem']
https://www.aosfatos.org/noticias/falso-rio-nilo-vermelho-lagoa-chile/,É falso que rio Nilo amanheceu vermelho; vídeo mostra lagoa no Chile,falso,['checagem']
https://www.aosfatos.org/noticias/falso-video-ondas-ponte-rio-niteroi/,Vídeo não mostra fortes ondas atingindo ponte Rio-Niterói,falso,['checagem']
https://www.aosfatos.org/noticias/registro-tiroteio-egito-circula-invasao-hospital-gaza/,Registro de tiroteio no Egito circula como se mostrasse invasão a hospital na Faixa de Gaza,falso,['checagem']
https://www.aosfatos.org/noticias/video-manifestacao-paulista-2018-nao-protesto-recente-lula/,"Vídeo de manifestação na Paulista é de 2018, não de protesto recente contra Lula",falso,['checagem']
https://www.aosfatos.org/noticias/falso-video-manifestacao-contra-lula/,Vídeo de setembro de 2022 circula como se mostrasse manifestação recente em Brasília contra governo Lula,falso,['checagem']
https://www.aosfatos.org/noticias/falso-bolsonaro-lula-brasileiros-gaza/,É falso que Bolsonaro recebeu antes de Lula brasileiros repatriados da Faixa de Gaza,falso,['checagem']
https://www.aosfatos.org/noticias/video-antigo-mexico-circula-destruicao-tunel-do-hamas/,Vídeo antigo de explosão em mercado no México circula como se mostrasse destruição de túnel do Hamas,falso,['checagem']
https://www.aosfatos.org/noticias/video-flavio-dino-comediante-mulher-lider-comando-vermelho/,"Dino diz em vídeo ser fã de comediante, não de mulher de líder do Comando Vermelho",falso,['checagem']
https://www.aosfatos.org/noticias/falso-video-bandeira-barcarena-versao-comunista-simbolo-nacional/,"Vídeo mostra bandeira de Barcarena, no Pará, e não versão comunista do símbolo nacional",falso,['checagem']
https://www.aosfatos.org/noticias/falso-lula-2018-brasil-reservas/,"Lula se referia a dados de 2018 quando disse que Brasil tinha R$ 1,45 trilhão em reservas",falso,['checagem']
https://www.aosfatos.org/noticias/falsa-foto-sergio-massa-mesa-com-cocaina/,É falsa foto que mostra Sergio Massa diante de mesa com cocaína,falso,['checagem']
https://www.aosfatos.org/noticias/falso-video-libano-encenacao-palestinos-culpar-israel/,"Vídeo mostra gravação no Líbano, não encenação feita por palestinos para culpar Israel por violência",falso,['checagem']
https://www.aosfatos.org/noticias/falso-marina-silva-nanomisseis-incendios-amazonia/,Marina Silva não disse que nanomísseis e irregularidades cósmicas são causa de incêndios na Amazônia,falso,['checagem']
https://www.aosfatos.org/noticias/falso-video-sergio-massa-cocaina/,É falso vídeo que mostra Sergio Massa cheirando cocaína,falso,['checagem']
https://www.aosfatos.org/noticias/video-falso-militares-venezuelanos-no-Brasil/,Vídeo não mostra militares venezuelanos discutindo com civis brasileiros,falso,['checagem']
https://www.aosfatos.org/noticias/acao-contra-vacinacao-criancas-antiga-derrubada-justica-2022/,Ação contra vacinação de crianças e adolescentes não é recente e foi derrubada pela Justiça em 2022,falso,['checagem']
https://www.aosfatos.org/noticias/posts-usam-video-antigo-afirmar-governo-lula-defende-taxacao-do-sol/,Posts usam vídeo antigo para afirmar que governo Lula defende ‘taxação do sol’,falso,['checagem']
https://www.aosfatos.org/noticias/video-antigo-de-seguranca-agredindo-crianca-na-suecia-e-falsamente-relacionado-a-conflito-entre-hamas-e-israel/,Vídeo antigo de segurança agredindo criança na Suécia é falsamente relacionado a conflito entre Hamas e Israel,falso,['checagem']
