link,titulo,veredito,tags
https://www.aosfatos.org/noticias/video-nao-mostra-bolsonaro-trem-para-maranhao/,Vídeo não mostra Bolsonaro em trem que vai do Pará ao Maranhão,falso,['checagem']
https://www.aosfatos.org/noticias/ponte-rio-mt-nao-obra-governo-bolsonaro/,Ponte sobre rio em MT não é obra do governo Bolsonaro,falso,['checagem']
https://www.aosfatos.org/noticias/bolsonaro-nao-disse-estadao-morrer-muita-gente-se-lula-vencer-eleicao/,Bolsonaro não disse ao ‘Estadão’ que ‘vai morrer muita gente’ se Lula vencer eleição,falso,['checagem']
https://www.aosfatos.org/noticias/atirador-de-elite-canadense-nao-morto-sniper-russo-ucrania/,Não é verdade que atirador de elite canadense foi morto por sniper russo na Ucrânia,falso,['checagem']
https://www.aosfatos.org/noticias/barroso-nao-disse-bolsonaro-so-sera-reeleito-por-cima-do-seu-cadaver/,Barroso não disse que Bolsonaro só será reeleito ‘por cima do seu cadáver’,falso,['checagem']
https://www.aosfatos.org/noticias/5-abril-2022-renato-aragao-nao-morreu/,Postagens de 5 de abril de 2022 mentem ao dizer que Renato Aragão morreu,falso,['checagem']
https://www.aosfatos.org/noticias/2018-video-protesto-contra-lula-camara-guarapuava/,É de 2018 vídeo que registra protesto contra Lula na Câmara de Guarapuava,distorcido,['checagem']
https://www.aosfatos.org/noticias/video-abordagem-policia-torcedores-sport-nao-saqueadores-supermercado/,"Vídeo mostra abordagem da polícia a torcedores do Sport, não a saqueadores de supermercado",falso,['checagem']
https://www.aosfatos.org/noticias/falso-g1-noticiou-suzane-von-richthofen-declarou-voto-lula/,É falso que ‘G1’ noticiou que Suzane von Richthofen declarou voto em Lula,falso,['checagem']
https://www.aosfatos.org/noticias/nao-foi-gravado-lollapalooza-video-cantora-urina-fa/,Não foi gravado no Lollapalooza vídeo em que cantora urina em fã,falso,['checagem']
https://www.aosfatos.org/noticias/homem-foto-tatuagem-nazista-nao-chefe-policia-kiev/,Homem que aparece em foto com tatuagem nazista não é chefe da polícia de Kiev,falso,['checagem']
https://www.aosfatos.org/noticias/moto-bmw-detalhes-verde-amarelo-nao-homenagem-bolsonaro/,Moto da BMW com detalhes em verde e amarelo não é homenagem a Bolsonaro,falso,['checagem']
https://www.aosfatos.org/noticias/falso-menino-ucraniano-sozinho-fronteira/,Menino ucraniano mostrado em foto não atravessou sozinho fronteira com a Polônia,distorcido,['checagem']
https://www.aosfatos.org/noticias/falso-eleitores-mais-70-anos-renovar-titulo-biometria/,É falso que eleitores com mais 70 anos devem renovar título e fazer biometria para votar,falso,['checagem']
https://www.aosfatos.org/noticias/video-gusttavo-lima-beija-bandeira-brasil-anterior-lollapalooza/,Vídeo em que Gusttavo Lima beija bandeira do Brasil é anterior ao Lollapalooza,falso,['checagem']
https://www.aosfatos.org/noticias/foto-mostra-performance-de-mc-rebecca-e-luisa-sonza-nao-de-anitta-e-pabllo-vittar/,"Foto mostra performance de MC Rebecca e Luísa Sonza, não de Anitta e Pabllo Vittar",falso,['checagem']
https://www.aosfatos.org/noticias/montagem-video-xingamentos-lula-jogo-brasil-maracana/,É montagem vídeo que mostra xingamentos a Lula em jogo do Brasil no Maracanã,falso,['checagem']
https://www.aosfatos.org/noticias/pressao-arterial-nao-pode-ser-medida-ao-comprimir-pulso-na-parede/,Pressão arterial não pode ser medida ao comprimir pulso na parede,falso,['checagem']
https://www.aosfatos.org/noticias/carregamento-cartao-memoria-urna-eletronica-nao-favorece-acao-hackers/,Carregamento de cartão de memória usado em urna eletrônica não favorece ação de hackers,distorcido,['checagem']
https://www.aosfatos.org/noticias/falso-pessoas-com-mais-70-anos-terao-titulo-eleitor-cancelado/,É falso que pessoas com mais de 70 anos terão título de eleitor cancelado,falso,['checagem']
https://www.aosfatos.org/noticias/versao-falsa-depoimento-lula-moro-2017/,Posts difundem versão falsa de depoimento de Lula a Moro em 2017,falso,['checagem']
https://www.aosfatos.org/noticias/video-nao-mostra-transferencia-crucifixo-catedral-kiev-bunker/,Vídeo não mostra transferência de crucifixo da catedral de Kiev para bunker,falso,['checagem']
https://www.aosfatos.org/noticias/pesquisa-bolsonaro-65-intencoes-voto-falsa/,Pesquisa em que Bolsonaro aparece com 65% das intenções de voto é falsa,falso,['checagem']
https://www.aosfatos.org/noticias/tv-italiana-nao-usou-cena-filme-impacto-profundo-fuga-de-kiev/,TV italiana não usou cena do filme ‘Impacto Profundo’ para ilustrar fuga de Kiev,falso,['checagem']
https://www.aosfatos.org/noticias/falso-video-maquinas-compradas-governo-federal-retidas-sp/,É falso que vídeo mostra máquinas compradas pelo governo federal e retidas em SP,falso,['checagem']
https://www.aosfatos.org/noticias/fazenda-para-mostrada-video-nao-pertence-filho-lula/,Fazenda no Pará mostrada em vídeo não pertence a filho de Lula,falso,['checagem']
https://www.aosfatos.org/noticias/kamala-harris-nao-riu-pergunta-refugiados-ucranianos-entrevista/,Posts enganam ao alegar que Kamala Harris riu de pergunta sobre refugiados ucranianos,distorcido,['checagem']
https://www.aosfatos.org/noticias/alexandre-de-moraes-nao-mandou-pf-prender-otoni-de-paula/,Alexandre de Moraes não mandou PF prender Otoni de Paula,falso,['checagem']
https://www.aosfatos.org/noticias/falso-documento-pfizer-pagou-aprovacao-vacina-eua/,É falso que documento atesta que Pfizer pagou por aprovação de vacina nos EUA,falso,['checagem']
https://www.aosfatos.org/noticias/briga-senado-2017-reuniao-lula/,Vídeo de briga no Senado em 2017 é compartilhado como se fosse de reunião com Lula,falso,['checagem']
https://www.aosfatos.org/noticias/tweet-moro-telegram-moraes/,É falso tweet em que Moro elogia Alexandre de Moraes por banir Telegram,falso,['checagem']
https://www.aosfatos.org/noticias/protesto-lula-curitiba-2018/,"Manifestação contra Lula em Curitiba foi registrada em 2018, não recentemente",falso,['checagem']
https://www.aosfatos.org/noticias/recepcao-bolsonaro-salvador-2018/,Vídeo de recepção a Bolsonaro em Salvador em 2018 é difundido como se fosse recente,falso,['checagem']
https://www.aosfatos.org/noticias/video-enchente-petropolis-fevereiro/,"Vídeo que mostra enchente em Petrópolis é de fevereiro, não atual",distorcido,['checagem']
https://www.aosfatos.org/noticias/corrente-gilmar-mendes-STF/,Texto usa alegações enganosas para dizer que entrada de Gilmar Mendes no STF foi ilegal,distorcido,['checagem']
https://www.aosfatos.org/noticias/outdoor-lula-alta-floresta/,Foto de outdoor contra Lula é editada para fazer crer que placa está em outras cidades,falso,['checagem']
https://www.aosfatos.org/noticias/video-antigo-guerra-brasil-venezuela/,Publicações usam vídeo antigo para sugerir risco de guerra entre Brasil e Venezuela,distorcido,['checagem']
https://www.aosfatos.org/noticias/lula-hang-twitter/,É falsa interação entre Lula e Luciano Hang no Twitter sobre lojas Havan,falso,['checagem']
https://www.aosfatos.org/noticias/presidente-petrobras-acao-eua-gasolina/,Presidente da Petrobras não relacionou alta da gasolina a ação indenizatória nos EUA,falso,['checagem']
https://www.aosfatos.org/noticias/rs-gasolina-icms-65/,É falso que Rio Grande do Sul cobra 65% de ICMS sobre a gasolina,falso,['checagem']
https://www.aosfatos.org/noticias/navio-russo-suspeito-Brasil-2020/,Reportagem sobre presença no Brasil de navio russo suspeito de espionagem é de 2020,distorcido,['checagem']
https://www.aosfatos.org/noticias/cantores-endless-love-ucrania/,Não são o presidente e a primeira-dama da Ucrânia dupla que canta em vídeo,falso,['checagem']
https://www.aosfatos.org/noticias/gasolina-argentina-video-208/,"Preço do litro da gasolina na Argentina mostrado em vídeo equivale a R$ 4,98, não R$ 2,08",distorcido,['checagem']
https://www.aosfatos.org/noticias/simulacao-digital-bombardeio-ucrania/,Simulação digital de batalha é difundida como se fosse cena de bombardeio na Ucrânia,falso,['checagem']
https://www.aosfatos.org/noticias/soldado-chora-iraque-ucrania/,"Vídeo mostra choro de soldado no Iraque, não militar russo que se nega a invadir Kiev",falso,['checagem']
https://www.aosfatos.org/noticias/cartaz-zelenski-bolsonaro/,É montagem foto de ucraniana com cartaz 'queríamos que Zelenski fosse Bolsonaro',falso,['checagem']
https://www.aosfatos.org/noticias/criancas-veiculos-militares-ucrania/,Foto que mostra crianças ao lado de veículos militares ucranianos é de 2016,distorcido,['checagem']
https://www.aosfatos.org/noticias/arthur-do-val-xingado-video/,É falso que vídeo mostra xingamentos a Arthur do Val em aeroporto,falso,['checagem']
https://www.aosfatos.org/noticias/video-antigo-felipe-neto-voto-bolsonaro/,"Vídeo em que Felipe Neto diz que votaria em Bolsonaro contra Lula é de 2017, não atual",distorcido,['checagem']
https://www.aosfatos.org/noticias/ato-austria-falso-morto-ucrania/,Não é verdade que reportagem mostrou falso morto na guerra na Ucrânia,falso,['checagem']
https://www.aosfatos.org/noticias/video-oracao-polonia-ucrania/,"Vídeo de homens ajoelhados em oração foi gravado na Polônia, não na Ucrânia",falso,['checagem']
https://www.aosfatos.org/noticias/video-velocidade-reduzida-lula/,Vídeo é compartilhado com velocidade reduzida para sugerir que Lula estaria bêbado,falso,['checagem']
https://www.aosfatos.org/noticias/presidente-ucrania-camiseta-com-suastica/,Não é verdade que presidente da Ucrânia exibiu camiseta com suástica,falso,['checagem']
https://www.aosfatos.org/noticias/xingamento-lula-show--gusttavo-lima-portugal/,É falso que público xingou Lula em show de Gusttavo Lima em Portugal,falso,['checagem']
https://www.aosfatos.org/noticias/gusttavo-lima-bolsonaro-lisboa/,Público não gritou ‘Fora Bolsonaro’ em show de Gusttavo Lima em Portugal,falso,['checagem']
https://www.aosfatos.org/noticias/g1-lula-pix/,É falso que ‘G1’ publicou que Lula vai acabar com o Pix se eleito presidente,falso,['checagem']
https://www.aosfatos.org/noticias/falso-orwell-frase-mentiras-universais/,Não é de George Orwell frase sobre 'mentiras universais',falso,['checagem']
https://www.aosfatos.org/noticias/video-menina-enfrenta-soldado/,"Vídeo em que menina enfrenta soldado foi gravado na Palestina, não na Ucrânia",falso,['checagem']
https://www.aosfatos.org/noticias/miss-ucrania-forcas-armadas-guerra/,Miss Ucrânia 2015 não se juntou às forças armadas para lutar contra a Rússia,falso,['checagem']
https://www.aosfatos.org/noticias/video-avioes-russia-ensaio-militar/,Vídeo de 2020 de ensaio militar com aeronaves russas é atribuído à guerra na Ucrânia,falso,['checagem']
https://www.aosfatos.org/noticias/despedida-soldados-ucranianos-mulheres/,Não é recente vídeo que mostra ucranianos se despedindo de mulheres,distorcido,['checagem']
https://www.aosfatos.org/noticias/fotos-presidente-ucrania-fardado-guerra/,Fotos que mostram presidente da Ucrânia com uniforme militar são anteriores à guerra,falso,['checagem']
https://www.aosfatos.org/noticias/incendio-porto-china-bomba-termobarica-ucrania/,"Vídeo mostra incêndio em porto na China, não explosão de bomba termobárica na Ucrânia",falso,['checagem']
https://www.aosfatos.org/noticias/imagens-simulador-combate-aereo-atribuidas-guerra-ucrania/,Imagens de simulador de combate aéreo são atribuídas nas redes à guerra na Ucrânia,falso,['checagem']
https://www.aosfatos.org/noticias/video-que-mostra-motociata-com-bolsonaro-nao-e-atual-nem-foi-gravado-em-salvador/,Vídeo que mostra motociata com Bolsonaro não é atual nem foi gravado em Salvador,falso,['checagem']
https://www.aosfatos.org/noticias/falso-juiza-suprema-corte-eua-presa-suborno/,É falso que juíza da Suprema Corte dos EUA foi presa por aceitar suborno,falso,['checagem']
https://www.aosfatos.org/noticias/guerra-ucrania-foto-falso-ataque-gaza-2021/,Posts atribuem à guerra na Ucrânia foto que mostra ataque a Gaza em 2021,falso,['checagem']
https://www.aosfatos.org/noticias/imagem-grupo-oracao-ucrania-2019/,"Imagem que mostra grupo de oração em praça na Ucrânia é de 2019, não atual",distorcido,['checagem']
https://www.aosfatos.org/noticias/foto-crianca-guerra-ucrania-filme-russo/,"Foto em que criança chora ao lado de morto não retrata guerra na Ucrânia, mas filme russo",falso,['checagem']
https://www.aosfatos.org/noticias/falso-fotos-tchernobil-tropas-russas/,Postagens associam fotos de 2014 à ocupação de Tchernóbil por tropas russas,falso,['checagem']
https://www.aosfatos.org/noticias/video-ataque-drone-siria-ucrania/,"Vídeo que mostra ataque de drone foi gravado na Síria, não na Ucrânia",falso,['checagem']
https://www.aosfatos.org/noticias/2015-foto-pessoas-rezam-ajoelhadas-praca-ucrania/,É de 2015 foto em que pessoas rezam ajoelhadas em praça na Ucrânia,falso,['checagem']
https://www.aosfatos.org/noticias/checamos-videogame-ataque-russo-ucrania/,Cena de videogame circula em postagens como se fosse de ataque russo à Ucrânia,falso,['checagem']
https://www.aosfatos.org/noticias/foto-ataque-israel-gaza-conflito-ucrania/,Foto que mostra ataque de Israel a Gaza é atribuída em posts ao conflito na Ucrânia,falso,['checagem']
https://www.aosfatos.org/noticias/video-misseis-faixa-de-gaza-ucrania/,"Vídeo mostra disparo de mísseis na Faixa de Gaza, não na Ucrânia",falso,['checagem']
https://www.aosfatos.org/noticias/oms-ema-doses-reforco-vacina-covid19-sistema-imunologico/,OMS e EMA não disseram que doses de reforço da vacina contra Covid-19 danificam sistema imunológico,falso,['checagem']
https://www.aosfatos.org/noticias/audio-ataques-igrejas-deputado-pt/,Áudio em que homem incita ataques a igrejas não foi gravado por ex-deputado do PT,falso,['checagem']
https://www.aosfatos.org/noticias/apreensao-ouro-ongs-exercito-amazonia/,Vídeo não mostra apreensão de ouro de ONGs pelo Exército na Amazônia,falso,['checagem']
https://www.aosfatos.org/noticias/g1-pt-cronograma-recolher-armas/,Não é verdade que ‘G1’ publicou que PT teria cronograma para recolher armas de fogo,falso,['checagem']
https://www.aosfatos.org/noticias/e-falso-que-tv-noticiou-que-rainha-elizabeth-tomou-ivermectina-para-covid-19/,É falso que TV noticiou que rainha Elizabeth tomou ivermectina para Covid-19,falso,['checagem']
https://www.aosfatos.org/noticias/postos-governo-federal-gasolina-diesel-bahia/,"Não é verdade que postos do governo federal vendem gasolina e diesel a R$ 2,80 na Bahia",falso,['checagem']
https://www.aosfatos.org/noticias/barroso-2012-sobrevoo-avioes-stf/,É falso que Barroso se referia a caso de 2012 quando citou sobrevoo de caças no STF,falso,['checagem']
https://www.aosfatos.org/noticias/video-tempestade-petropolis-ibirite/,Vídeo atribuído em postagens a tempestade em Petrópolis foi gravado em Ibirité,falso,['checagem']
https://www.aosfatos.org/noticias/arnaldo-jabor-texto-bolsonaro-rustico-verdadeiro/,Arnaldo Jabor não escreveu texto que elogia Bolsonaro por ser ‘rústico e verdadeiro’,falso,['checagem']
https://www.aosfatos.org/noticias/familia-rothschild-patente-teste-covid19-2015/,Não é verdade que família Rothschild registrou patente de teste de Covid-19 em 2015,falso,['checagem']
https://www.aosfatos.org/noticias/video-recorre-a-informacoes-falsas-para-atacar-credibilidade-de-pesquisas-eleitorais/,Vídeo recorre a informações falsas para atacar credibilidade de pesquisas eleitorais,falso,['checagem']
https://www.aosfatos.org/noticias/bolsonaro-primeiro-ministro-canada-g20/,É falso que Bolsonaro não cumprimentou primeiro-ministro do Canadá no G20,falso,['checagem']
https://www.aosfatos.org/noticias/video-evento-bolsonaro-bahrein-russia/,Vídeo de evento com Bolsonaro no Bahrein circula em posts como se fosse na Rússia,falso,['checagem']
https://www.aosfatos.org/noticias/antigo-video-braga-netto-eleicoes-voto-impresso/,É antigo vídeo que alega que Braga Netto condicionou eleições a voto impresso,distorcido,['checagem']
https://www.aosfatos.org/noticias/video-recepcao-bolsonaro-italia-russia/,"Vídeo que mostra recepção a Bolsonaro foi gravado na Itália, não na Rússia",falso,['checagem']
https://www.aosfatos.org/noticias/mensagem-bolsonaro-predio-localiza-bh/,Mensagem pró-Bolsonaro não foi exibida na fachada de prédio da Localiza em MG,falso,['checagem']
https://www.aosfatos.org/noticias/oms-hidroxicloroquina-azitromicina-covid19/,É falso que OMS se desculpou por não recomendar hidroxicloroquina e azitromicina contra Covid-19,falso,['checagem']
https://www.aosfatos.org/noticias/fmi-ranking-brasil-resultado-fiscal-mundo/,FMI não divulgou ranking em que Brasil registra 2º melhor resultado fiscal do mundo,falso,['checagem']
https://www.aosfatos.org/noticias/pf-novo-depoimento-adelio-pt-facada-bolsonaro/,PF nega existência de novo depoimento em que Adélio incriminaria PT por facada em Bolsonaro,falso,['checagem']
https://www.aosfatos.org/noticias/musicos-funk-bolsonaro-moro/,É falso que músicos tocaram ‘Funk do Bolsonaro’ na frente de Moro,falso,['checagem']
https://www.aosfatos.org/noticias/bolsonaro-alistamento-exercito-nazista/,Bolsonaro não disse que se alistaria no exército nazista ‘sem problema nenhum’,falso,['checagem']
https://www.aosfatos.org/noticias/tv-alema-falso-cadaver-vitima-omicron/,Não é verdade que TV alemã exibiu falso cadáver como se fosse vítima da ômicron,falso,['checagem']
https://www.aosfatos.org/noticias/video-ex-ministro-suica-rindo-lula-marisa-leticia/,Vídeo não mostra ex-ministro da Suíça rindo de Lula e Marisa Letícia,falso,['checagem']
https://www.aosfatos.org/noticias/urna-eletronica-tse-certificada-inmetro/,Postagens enganam ao alegar que urna eletrônica deveria ser certificada pelo Inmetro,falso,['checagem']
https://www.aosfatos.org/noticias/video-motociata-bolsonaro-caico-rn/,Não é atual nem foi gravado no RN vídeo que mostra motociata em apoio a Bolsonaro,falso,['checagem']
https://www.aosfatos.org/noticias/video-policiais-mortos-colombia-chile/,"Vídeo que mostra policiais mortos foi gravado na Colômbia, não no Chile",falso,['checagem']
https://www.aosfatos.org/noticias/aline-midlej-tomar-vacina-pior-que-morrer-apos-tres-doses/,É falso que Aline Midlej disse que não tomar vacina é pior que morrer após três doses,falso,['checagem']
https://www.aosfatos.org/noticias/cdc-casos-miocardite-vacinas-covid19/,CDC não registrou 21 mil casos de miocardite relacionados a vacinas contra Covid-19,falso,['checagem']
https://www.aosfatos.org/noticias/tweet-lula-corte-beneficios-igrejas/,É falso tweet em que Lula diz que vai cortar benefícios de igrejas,falso,['checagem']
https://www.aosfatos.org/noticias/farmaceutica-japonesa-nao-comprovou-eficacia-ivermectina-covid-humanos/,Farmacêutica japonesa não comprovou eficácia da ivermectina contra Covid-19 em humanos,falso,['checagem']
https://www.aosfatos.org/noticias/fundador-forum-economico-mundial-nao-disse-cientistas-midia-nos-bolsos/,Fundador do Fórum Econômico Mundial não disse que tem cientistas e mídia ‘nos bolsos’,falso,['checagem']
https://www.aosfatos.org/noticias/e-falso-sindicato-professores-stf-contra-reajuste-piso-categoria/,É falso que sindicato de professores foi ao STF contra reajuste do piso da categoria,falso,['checagem']
https://www.aosfatos.org/noticias/foto-mostra-manifestacao-em-moscou-em-1991-nao-protesto-recente-em-ottawa/,"Foto mostra manifestação em Moscou em 1991, não protesto recente em Ottawa",falso,['checagem']
https://www.aosfatos.org/noticias/video-em-que-bolsonaro-caminha-com-apoiadores-nao-e-recente-nem-foi-gravado-em-franco-da-rocha/,Vídeo em que Bolsonaro caminha com apoiadores não é recente nem foi gravado em Franco da Rocha,falso,['checagem']
https://www.aosfatos.org/noticias/video-condominio-cdhu-obra-governo-bolsonaro/,Vídeo engana ao afirmar que condomínio da CDHU seria obra do governo Bolsonaro,falso,['checagem']
https://www.aosfatos.org/noticias/fundacao-vacina-covid-19-casos-miocardite-eua/,Fundação não disse que vacina contra Covid-19 provocou 2.236 casos de miocardite nos EUA,falso,['checagem']
https://www.aosfatos.org/noticias/montagem-video-bonner-haddad-bolsonaro-investigado/,É montagem vídeo em que Bonner diz para Haddad que Bolsonaro não era investigado,falso,['checagem']
https://www.aosfatos.org/noticias/sp-verba-reajuste-policiais-obra-marginal-tiete/,SP não anunciou que usará verba de reajuste de policiais em obra na marginal Tietê,falso,['checagem']
https://www.aosfatos.org/noticias/henry-kissinger-discurso-vacinas-conselho-eugenia-oms/,Henry Kissinger não fez discurso sobre vacinas em ‘conselho de eugenia’ da OMS,falso,['checagem']
https://www.aosfatos.org/noticias/nao-mourao-fala-investigacao-mandantes-facada-bolsonaro/,Não é de Mourão fala sobre investigação de mandantes da facada em Bolsonaro,falso,['checagem']
https://www.aosfatos.org/noticias/video-que-mostra-construcao-de-lanchas-escolares-e-anterior-ao-governo-bolsonaro/,Vídeo que mostra construção de lanchas escolares é anterior ao governo Bolsonaro,falso,['checagem']
https://www.aosfatos.org/noticias/resultado-positivo-covid-limao-nao-prova-testes-ineficazes/,Resultado positivo de Covid-19 em limão não prova que testes são ineficazes,falso,['checagem']
https://www.aosfatos.org/noticias/e-falso-bolsonaro-recebe-r-68-mil-aposentadoria/,É falso que Bolsonaro recebe R$ 68 mil mensais de aposentadoria,falso,['checagem']
https://www.aosfatos.org/noticias/verissimo-nao-escreveu-assistir-bbb-ajuda-globo-ganhar-rios-dinheiro/,Verissimo não escreveu que ‘assistir ao BBB é ajudar a Globo a ganhar rios de dinheiro’,falso,['checagem']
https://www.aosfatos.org/noticias/video-fazenda-sul-coreanos-brasil-atribuido-posts-propaganda-chinesa/,Vídeo de fazenda de sul-coreanos no Brasil é atribuído em posts a propaganda chinesa,falso,['checagem']
https://www.aosfatos.org/noticias/taliria-petrone-nao-propos-projeto-profissao-ladrao/,Talíria Petrone não propôs projeto de lei para criar ‘profissão de ladrão’,falso,['checagem']
https://www.aosfatos.org/noticias/video-mostra-protesto-agricultores-alemanha-nao-antivacina-canada/,"Vídeo mostra protesto de agricultores na Alemanha, não ato antivacina no Canadá",falso,['checagem']
https://www.aosfatos.org/noticias/e-falso-lula-nao-deixou-flores-museu-holocausto-israel/,É falso que Lula não deixou flores em visita ao Museu do Holocausto em Israel,falso,['checagem']
https://www.aosfatos.org/noticias/flavio-dino-nao-fechou-posto-prf-maranhao/,Flávio Dino não fechou posto da PRF no Maranhão,falso,['checagem']
https://www.aosfatos.org/noticias/e-falso-video-destruicao-celulares-confiscados-taliba-afeganistao/,É falso que vídeo mostra destruição de celulares confiscados pelo Talibã no Afeganistão,falso,['checagem']
https://www.aosfatos.org/noticias/ivermectina-antiviral-pfizer-nao-agem-mesma-forma-contra-coronavirus/,Ivermectina e antiviral da Pfizer não agem da mesma forma contra o novo coronavírus,falso,['checagem']
https://www.aosfatos.org/noticias/video-agressao-homem-bateu-policia-militar-2015-nao-recente/,"Vídeo que mostra agressão a homem que bateu em PMs é de 2015, não recente",distorcido,['checagem']
https://www.aosfatos.org/noticias/anvisa-nao-aprovou-vacina-pfizer-adolescentes-antes-testes-clinicos/,Anvisa não aprovou vacina da Pfizer para adolescentes antes de testes clínicos,distorcido,['checagem']
https://www.aosfatos.org/noticias/hashtags-criticas-globo-encontro-fatima-bernardes/,Hashtags críticas à Globo não foram mostradas ao vivo no Encontro com Fátima Bernardes,distorcido,['checagem']
https://www.aosfatos.org/noticias/e-falso-que-eleitor-sem-cadastro-biometrico-nao-podera-votar-neste-ano/,É falso que eleitor sem cadastro biométrico não poderá votar neste ano,falso,['checagem']
https://www.aosfatos.org/noticias/falso-publico-lula-ladrao-show-ivete-sangalo/,É falso que público chamou Lula de ladrão em show que Ivete Sangalo levou tombo,falso,['checagem']
https://www.aosfatos.org/noticias/e-de-2019-pesquisa-que-mostra-bolsonaro-mais-bem-avaliado-que-fhc-lula-e-dilma/,"É de 2019 pesquisa que mostra Bolsonaro mais bem avaliado que FHC, Lula e Dilma",distorcido,['checagem']
https://www.aosfatos.org/noticias/video-pai-desesperado-filho-vacinas-covid-paraiba/,Vídeo que mostra pai desesperado em hospital é de 2019 e sem relação com vacinas,falso,['checagem']
https://www.aosfatos.org/noticias/nao-e-verdade-que-projeto-de-lei-quer-proibir-sinuca-no-brasil-por-considerar-o-jogo-racista/,Não é verdade que projeto de lei quer proibir sinuca no Brasil por considerar o jogo racista,falso,['checagem']
https://www.aosfatos.org/noticias/e-falso-que-crianca-foi-presa-em-nova-york-por-estar-sem-passaporte-da-vacina/,É falso que criança foi presa em Nova York por estar sem passaporte da vacina,falso,['checagem']
https://www.aosfatos.org/noticias/video-e-editado-para-fazer-crer-que-lula-disse-que-foi-possuido-por-demonio/,Vídeo é editado para fazer crer que Lula disse que foi possuído por demônio,falso,['checagem']
https://www.aosfatos.org/noticias/japao-nao-vai-substituir-vacinas-por-ivermectina-para-conter-a-covid-19/,Japão não vai substituir vacinas por ivermectina para conter a Covid-19,falso,['checagem']
https://www.aosfatos.org/noticias/e-falso-que-g1-noticiou-que-super-tomate-da-embrapa-reduz-inflamacoes-na-prostata/,É falso que ‘G1’ noticiou que ‘super tomate’ da Embrapa reduz inflamações na próstata,falso,['checagem']
https://www.aosfatos.org/noticias/video-nao-mostra-obra-do-governo-bolsonaro-mas-reparo-em-ferrovia-na-estonia/,"Vídeo não mostra obra do governo Bolsonaro, mas reparo em ferrovia na Estônia",falso,['checagem']
